{
  "event_id": "22222222-2222-4222-8222-222222222222",
  "event_type": "TenantState",
  "schema_version": 1,
  "occurred_at": "2026-10-02T09:15:30.123456+00:00",
  "producer": "identity",
  "tenant_id": "3f2b8c1e-6d4a-4b7e-9c1f-2a5d8e7b6c40",
  "aggregate_id": "3f2b8c1e-6d4a-4b7e-9c1f-2a5d8e7b6c40",
  "correlation_id": "7d9e1f20-3a4b-4c5d-8e6f-708192a3b4c5",
  "payload": {
    "tenant_id": "3f2b8c1e-6d4a-4b7e-9c1f-2a5d8e7b6c40",
    "name": "Acme",
    "slug": "acme",
    "is_active": true,
    "version": 1
  }
}
