{
  "event_id": "55555555-5555-4555-8555-555555555555",
  "event_type": "LeadLeftUnassigned",
  "schema_version": 1,
  "occurred_at": "2026-10-02T09:15:30.123456+00:00",
  "producer": "lead-core",
  "tenant_id": "3f2b8c1e-6d4a-4b7e-9c1f-2a5d8e7b6c40",
  "aggregate_id": "c0ffee00-1234-4abc-8def-001122334455",
  "correlation_id": "7d9e1f20-3a4b-4c5d-8e6f-708192a3b4c5",
  "payload": {
    "tenant_id": "3f2b8c1e-6d4a-4b7e-9c1f-2a5d8e7b6c40",
    "lead_id": "c0ffee00-1234-4abc-8def-001122334455"
  }
}
